{"schemaVersion":1,"id":"dec_1","marketStateId":"mkt_1","choice":"LONG","typedAnswers":{"regime":{"kind":"CHOICE","questionVersion":"q1","choice":"TREND","confidence":"0.80","distribution":{"TREND":"0.80","RANGE":"0.15","UNCERTAIN":"0.05"}},"evidenceQuality":{"kind":"SCORE","questionVersion":"q1","score":"0.7","legend":{"0":"low","1":"high"},"distribution":{"0":"0.3","1":"0.7"},"confidence":"0.90"},"signalConflict":{"kind":"NOUL","questionVersion":"q1","noul":"0.10"}},"confidence":"0.80","distribution":{"LONG":"0.80","FLAT":"0.15","ABSTAIN":"0.05"},"regime":"TREND","evidenceQuality":"0.70","signalConflict":"0.10","modelId":"mock-v1","promptVersion":"p1","questionVersion":"q1","configVersion":"c1","inputHash":"aaaaaaaaaaaaaaaaaaaaaaaaaaaaaaaaaaaaaaaaaaaaaaaaaaaaaaaaaaaaaaaa","latencyMs":8,"apiUnits":null,"estimatedCost":null,"validUntil":"2026-10-12T15:00:00Z","traceId":"4bf92f3577b34da6a3ce929d0e0e4736","reasonCode":"OK"}
